"Status","Start Time","Stop Time","Duration in ms","Parent Suite","Suite","Sub Suite","Test Class","Test Method","Name","Description"
"passed","Thu Dec 23 01:12:53 GMT 2021","Thu Dec 23 01:13:09 GMT 2021","16036","","Contract: ERC721 with minted tokens transfers via safeTransferFrom with data to a valid receiver contract when called by the operator","","Contract: ERC721 with minted tokens transfers via safeTransferFrom with data to a valid receiver contract when called by the operator","emits an Approval event","emits an Approval event",""
"passed","Thu Dec 23 00:50:44 GMT 2021","Thu Dec 23 00:50:48 GMT 2021","4366","","Contract: ERC20 balanceOf when the requested account has some tokens","","Contract: ERC20 balanceOf when the requested account has some tokens","returns the total amount of tokens","returns the total amount of tokens",""
"passed","Thu Dec 23 01:48:19 GMT 2021","Thu Dec 23 01:48:29 GMT 2021","9827","","Contract: Address functionCall with valid contract receiver","","Contract: Address functionCall with valid contract receiver","calls the requested function","calls the requested function",""
"failed","Thu Dec 23 01:48:32 GMT 2021","Thu Dec 23 01:48:40 GMT 2021","7842","","Contract: Create2 deploy","","Contract: Create2 deploy","fails deploying a contract if factory contract does not have sufficient balance","fails deploying a contract if factory contract does not have sufficient balance",""
"passed","Thu Dec 23 01:05:32 GMT 2021","Thu Dec 23 01:05:40 GMT 2021","8412","","Contract: ERC1155 internal functions _burnBatch with minted-then-burnt tokens","","Contract: ERC1155 internal functions _burnBatch with minted-then-burnt tokens","emits a TransferBatch event","emits a TransferBatch event",""
"skipped","Thu Dec 23 00:36:32 GMT 2021","Thu Dec 23 00:36:32 GMT 2021","0","","Contract: TimelockController usage scenario","","Contract: TimelockController usage scenario","call payable with eth","call payable with eth",""
"passed","Thu Dec 23 01:47:54 GMT 2021","Thu Dec 23 01:47:58 GMT 2021","3727","","Contract: Create2 computeAddress","","Contract: Create2 computeAddress","computes the correct contract address with deployer","computes the correct contract address with deployer",""
"skipped","Thu Dec 23 00:50:13 GMT 2021","Thu Dec 23 00:50:13 GMT 2021","0","","Contract: ERC20VotesComp set delegation with signature","","Contract: ERC20VotesComp set delegation with signature","rejects expired permit","rejects expired permit",""
"passed","Thu Dec 23 00:52:06 GMT 2021","Thu Dec 23 00:52:10 GMT 2021","4319","","Contract: ERC721PresetMinterPauserAutoId Contract interface ERC721 balanceOf(address)","","Contract: ERC721PresetMinterPauserAutoId Contract interface ERC721 balanceOf(address)","has to be implemented","has to be implemented",""
"passed","Thu Dec 23 01:50:32 GMT 2021","Thu Dec 23 01:50:36 GMT 2021","3785","","Contract: SafeCast toInt64","","Contract: SafeCast toInt64","reverts when downcasting -2^63 - 2 (-9223372036854775810)","reverts when downcasting -2^63 - 2 (-9223372036854775810)",""
"failed","Thu Dec 23 01:47:23 GMT 2021","Thu Dec 23 01:47:38 GMT 2021","14781","","Contract: Address sendValue when sender contract has funds","","Contract: Address sendValue when sender contract has funds","sends the whole balance","sends the whole balance",""
"passed","Thu Dec 23 01:45:28 GMT 2021","Thu Dec 23 01:45:35 GMT 2021","6994","","Contract: ERC165Checker ERC165 not supported","","Contract: ERC165Checker ERC165 not supported","does not support ERC165","does not support ERC165",""
"passed","Thu Dec 23 01:42:39 GMT 2021","Thu Dec 23 01:42:47 GMT 2021","8766","","Contract: ERC721 _burn with minted tokens with burnt token","","Contract: ERC721 _burn with minted tokens with burnt token","emits a Transfer event","emits a Transfer event",""
"passed","Thu Dec 23 01:47:39 GMT 2021","Thu Dec 23 01:47:44 GMT 2021","5700","","Contract: EnumerableMap read get","","Contract: EnumerableMap read get","missing value","missing value",""
"passed","Thu Dec 23 00:54:08 GMT 2021","Thu Dec 23 00:54:18 GMT 2021","10460","","Contract: ERC1155Pausable when token is paused isApprovedForAll","","Contract: ERC1155Pausable when token is paused isApprovedForAll","returns the approval of the operator","returns the approval of the operator",""
"passed","Thu Dec 23 00:53:10 GMT 2021","Thu Dec 23 00:53:18 GMT 2021","8165","","Contract: ERC1155 like an ERC1155 balanceOfBatch when accounts own some tokens","","Contract: ERC1155 like an ERC1155 balanceOfBatch when accounts own some tokens","returns amounts owned by each account in order passed","returns amounts owned by each account in order passed",""
"passed","Thu Dec 23 00:54:22 GMT 2021","Thu Dec 23 00:54:32 GMT 2021","10153","","Contract: ERC1155 like an ERC1155 safeTransferFrom when called by the multiTokenHolder","","Contract: ERC1155 like an ERC1155 safeTransferFrom when called by the multiTokenHolder","credits transferred balance to receiver","credits transferred balance to receiver",""
"passed","Thu Dec 23 01:48:47 GMT 2021","Thu Dec 23 01:48:55 GMT 2021","8202","","Contract: EnumerableSet EnumerableUintSet add","","Contract: EnumerableSet EnumerableUintSet add","adds a value","adds a value",""
"passed","Thu Dec 23 01:19:54 GMT 2021","Thu Dec 23 01:20:08 GMT 2021","13344","","Contract: ERC721 with minted tokens transfers via safeTransferFrom without data to a user account when called by the approved individual","","Contract: ERC721 with minted tokens transfers via safeTransferFrom without data to a user account when called by the approved individual","clears the approval for the token ID","clears the approval for the token ID",""
"passed","Thu Dec 23 01:05:40 GMT 2021","Thu Dec 23 01:05:49 GMT 2021","8842","","Contract: ERC1155 internal functions _burnBatch with minted-then-burnt tokens","","Contract: ERC1155 internal functions _burnBatch with minted-then-burnt tokens","accounts for both minting and burning","accounts for both minting and burning",""
"broken","Thu Dec 23 00:24:15 GMT 2021","Thu Dec 23 00:24:15 GMT 2021","694","Ethers.js","","","","","shouldCreateAcccountWithEthersJs",""
"passed","Thu Dec 23 01:47:35 GMT 2021","Thu Dec 23 01:47:39 GMT 2021","4159","","Contract: SafeMath with default revert message mod modulos correctly","","Contract: SafeMath with default revert message mod modulos correctly","when the dividend is equal to the divisor","when the dividend is equal to the divisor",""
"passed","Thu Dec 23 01:07:57 GMT 2021","Thu Dec 23 01:08:10 GMT 2021","12725","","Contract: ERC721 with minted tokens transfers via safeTransferFrom with data to a user account when the address to transfer the token to is the zero address","","Contract: ERC721 with minted tokens transfers via safeTransferFrom with data to a user account when the address to transfer the token to is the zero address","reverts","reverts",""
"passed","Thu Dec 23 01:46:48 GMT 2021","Thu Dec 23 01:46:52 GMT 2021","4178","","Contract: SafeMath with default revert message sub","","Contract: SafeMath with default revert message sub","subtracts correctly","subtracts correctly",""
"passed","Thu Dec 23 00:53:58 GMT 2021","Thu Dec 23 00:54:08 GMT 2021","10201","","Contract: ERC1155Pausable when token is paused balanceOf","","Contract: ERC1155Pausable when token is paused balanceOf","returns the amount of tokens owned by the given address","returns the amount of tokens owned by the given address",""
"passed","Thu Dec 23 00:39:53 GMT 2021","Thu Dec 23 00:40:02 GMT 2021","8890","","Contract: Initializable basic testing without inheritance after initialize","","Contract: Initializable basic testing without inheritance after initialize","initializer does not run again","initializer does not run again",""
"skipped","Thu Dec 23 00:50:13 GMT 2021","Thu Dec 23 00:50:13 GMT 2021","0","","Contract: ERC20VotesComp set delegation with signature","","Contract: ERC20VotesComp set delegation with signature","rejects bad nonce","rejects bad nonce",""
"passed","Thu Dec 23 01:48:22 GMT 2021","Thu Dec 23 01:48:31 GMT 2021","8577","","Contract: ConditionalEscrow when withdrawal is disallowed","","Contract: ConditionalEscrow when withdrawal is disallowed","reverts on withdrawals","reverts on withdrawals",""
"passed","Thu Dec 23 01:38:32 GMT 2021","Thu Dec 23 01:38:41 GMT 2021","8576","","Contract: ERC721 with minted tokens approve when approving a non-zero address when there was no prior approval","","Contract: ERC721 with minted tokens approve when approving a non-zero address when there was no prior approval","emits an approval event","emits an approval event",""
"passed","Thu Dec 23 01:45:05 GMT 2021","Thu Dec 23 01:45:06 GMT 2021","901","","Contract: SignatureChecker (ERC1271) ERC1271 wallet","","Contract: SignatureChecker (ERC1271) ERC1271 wallet","with invalid signer","with invalid signer",""
"passed","Thu Dec 23 01:40:02 GMT 2021","Thu Dec 23 01:40:12 GMT 2021","10369","","Contract: ERC721 with minted tokens approve when the sender is an operator","","Contract: ERC721 with minted tokens approve when the sender is an operator","emits an approval event","emits an approval event",""
"passed","Thu Dec 23 01:05:58 GMT 2021","Thu Dec 23 01:06:03 GMT 2021","5000","","Contract: ERC1155 ERC1155MetadataURI _setURI","","Contract: ERC1155 ERC1155MetadataURI _setURI","emits no URI event","emits no URI event",""
"passed","Thu Dec 23 01:04:42 GMT 2021","Thu Dec 23 01:04:58 GMT 2021","15886","","Contract: ERC721 with minted tokens transfers via safeTransferFrom with data to a user account when called by the owner without an approved user","","Contract: ERC721 with minted tokens transfers via safeTransferFrom with data to a user account when called by the owner without an approved user","transfers the ownership of the given token ID to the given address","transfers the ownership of the given token ID to the given address",""
"passed","Thu Dec 23 00:30:46 GMT 2021","Thu Dec 23 00:30:58 GMT 2021","11641","","Contract: AccessControl setting role admin","","Contract: AccessControl setting role admin","a role's previous admins no longer grant roles","a role's previous admins no longer grant roles",""
"broken","Thu Dec 23 00:41:25 GMT 2021","Thu Dec 23 00:41:30 GMT 2021","5274","","Contract: ReentrancyGuard","","Contract: ReentrancyGuard","nonReentrant function can be called","nonReentrant function can be called",""
"passed","Thu Dec 23 00:50:23 GMT 2021","Thu Dec 23 00:50:28 GMT 2021","4552","","Contract: ERC20","","Contract: ERC20","has 18 decimals","has 18 decimals",""
"passed","Thu Dec 23 01:19:42 GMT 2021","Thu Dec 23 01:19:54 GMT 2021","12632","","Contract: ERC721 with minted tokens transfers via safeTransferFrom without data to a user account when called by the approved individual","","Contract: ERC721 with minted tokens transfers via safeTransferFrom without data to a user account when called by the approved individual","emits a Transfer event","emits a Transfer event",""
"skipped","Thu Dec 23 00:36:32 GMT 2021","Thu Dec 23 00:36:32 GMT 2021","0","","Contract: TimelockController methods cancel","","Contract: TimelockController methods cancel","proposer can cancel","proposer can cancel",""
"passed","Thu Dec 23 01:48:28 GMT 2021","Thu Dec 23 01:48:32 GMT 2021","4166","","Contract: SafeCast toInt8","","Contract: SafeCast toInt8","downcasts -2^7 (-128)","downcasts -2^7 (-128)",""
"passed","Thu Dec 23 00:57:12 GMT 2021","Thu Dec 23 00:57:24 GMT 2021","12408","","Contract: ERC1155 like an ERC1155 safeTransferFrom when sending to a valid receiver with data","","Contract: ERC1155 like an ERC1155 safeTransferFrom when sending to a valid receiver with data","emits a TransferSingle log","emits a TransferSingle log",""
"passed","Thu Dec 23 01:45:06 GMT 2021","Thu Dec 23 01:45:07 GMT 2021","893","","Contract: SignatureChecker (ERC1271) ERC1271 wallet","","Contract: SignatureChecker (ERC1271) ERC1271 wallet","with invalid signature","with invalid signature",""
"passed","Thu Dec 23 01:47:25 GMT 2021","Thu Dec 23 01:47:29 GMT 2021","4096","","Contract: SafeCast toUint128","","Contract: SafeCast toUint128","reverts when downcasting 2^128 (340282366920938463463374607431768211456)","reverts when downcasting 2^128 (340282366920938463463374607431768211456)",""
"passed","Thu Dec 23 01:47:31 GMT 2021","Thu Dec 23 01:47:38 GMT 2021","6949","","Contract: ERC165Checker ERC165 and many interfaces supported","","Contract: ERC165Checker ERC165 and many interfaces supported","supports all interfaceIds via getSupportedInterfaces","supports all interfaceIds via getSupportedInterfaces",""
"passed","Thu Dec 23 00:34:50 GMT 2021","Thu Dec 23 00:35:03 GMT 2021","12697","","Contract: PaymentSplitter once deployed release Token","","Contract: PaymentSplitter once deployed release Token","reverts if no funds to claim","reverts if no funds to claim",""
"passed","Thu Dec 23 00:51:39 GMT 2021","Thu Dec 23 00:51:49 GMT 2021","9854","","Contract: ERC721URIStorage token URI","","Contract: ERC721URIStorage token URI","base URI is added as a prefix to the token URI","base URI is added as a prefix to the token URI",""
"passed","Thu Dec 23 01:02:17 GMT 2021","Thu Dec 23 01:02:31 GMT 2021","13593","","Contract: ERC1155 like an ERC1155 safeBatchTransferFrom to a receiver contract that reverts only on single transfers","","Contract: ERC1155 like an ERC1155 safeBatchTransferFrom to a receiver contract that reverts only on single transfers","debits transferred balances from sender","debits transferred balances from sender",""
"passed","Thu Dec 23 00:50:19 GMT 2021","Thu Dec 23 00:50:25 GMT 2021","5699","","Contract: ERC20Permit","","Contract: ERC20Permit","domain separator","domain separator",""
"passed","Thu Dec 23 01:00:48 GMT 2021","Thu Dec 23 01:01:01 GMT 2021","13175","","Contract: ERC1155 like an ERC1155 safeBatchTransferFrom when sending to a valid receiver without data","","Contract: ERC1155 like an ERC1155 safeBatchTransferFrom when sending to a valid receiver without data","calls onERC1155BatchReceived","calls onERC1155BatchReceived",""
"passed","Thu Dec 23 00:54:52 GMT 2021","Thu Dec 23 00:55:04 GMT 2021","12801","","Contract: ERC721 with minted tokens transfers via transferFrom when called by the approved individual","","Contract: ERC721 with minted tokens transfers via transferFrom when called by the approved individual","emits a Transfer event","emits a Transfer event",""
"passed","Thu Dec 23 01:45:38 GMT 2021","Thu Dec 23 01:45:42 GMT 2021","4105","","Contract: SafeCast toUint8","","Contract: SafeCast toUint8","downcasts 2^8 - 1 (255)","downcasts 2^8 - 1 (255)",""
"passed","Thu Dec 23 01:48:25 GMT 2021","Thu Dec 23 01:48:29 GMT 2021","4061","","Contract: SafeMath with custom revert message mod modulos correctly","","Contract: SafeMath with custom revert message mod modulos correctly","when the dividend is larger than the divisor","when the dividend is larger than the divisor",""
"passed","Thu Dec 23 00:50:22 GMT 2021","Thu Dec 23 00:50:23 GMT 2021","903","","Contract: ERC20PresetFixedSupply burning","","Contract: ERC20PresetFixedSupply burning","decrements totalSupply","decrements totalSupply",""
"broken","Thu Dec 23 00:40:15 GMT 2021","Thu Dec 23 00:40:18 GMT 2021","2783","","Contract: BeaconProxy bad beacon is not accepted","","Contract: BeaconProxy bad beacon is not accepted","non-compliant beacon","non-compliant beacon",""
"passed","Thu Dec 23 01:45:59 GMT 2021","Thu Dec 23 01:46:03 GMT 2021","4041","","Contract: Math average","","Contract: Math average","is correctly calculated with one even and one odd number","is correctly calculated with one even and one odd number",""
"passed","Thu Dec 23 00:30:30 GMT 2021","Thu Dec 23 00:30:46 GMT 2021","15762","","Contract: AccessControl setting role admin","","Contract: AccessControl setting role admin","the new admin can revoke roles","the new admin can revoke roles",""
"passed","Thu Dec 23 01:20:45 GMT 2021","Thu Dec 23 01:20:59 GMT 2021","13278","","Contract: ERC721 with minted tokens transfers via safeTransferFrom without data to a user account when called by the operator","","Contract: ERC721 with minted tokens transfers via safeTransferFrom without data to a user account when called by the operator","transfers the ownership of the given token ID to the given address","transfers the ownership of the given token ID to the given address",""
"failed","Thu Dec 23 00:33:25 GMT 2021","Thu Dec 23 00:33:41 GMT 2021","16595","","Contract: PaymentSplitter once deployed accepts payments","","Contract: PaymentSplitter once deployed accepts payments","Ether","Ether",""
"passed","Thu Dec 23 01:45:51 GMT 2021","Thu Dec 23 01:45:55 GMT 2021","3972","","Contract: Math average","","Contract: Math average","is correctly calculated with two odd numbers","is correctly calculated with two odd numbers",""
"passed","Thu Dec 23 01:36:11 GMT 2021","Thu Dec 23 01:36:22 GMT 2021","11657","","Contract: ERC721 with minted tokens transfers via safeTransferFrom to a contract that does not implement the required function","","Contract: ERC721 with minted tokens transfers via safeTransferFrom to a contract that does not implement the required function","reverts","reverts",""
"passed","Thu Dec 23 00:50:32 GMT 2021","Thu Dec 23 00:50:46 GMT 2021","13217","","Contract: ERC20FlashMint flashLoan","","Contract: ERC20FlashMint flashLoan","success","success",""
"passed","Thu Dec 23 01:48:43 GMT 2021","Thu Dec 23 01:48:49 GMT 2021","6224","","Contract: Counters increment starting from 0","","Contract: Counters increment starting from 0","increments the current value by one","increments the current value by one",""
"failed","Thu Dec 23 01:47:06 GMT 2021","Thu Dec 23 01:47:10 GMT 2021","4205","","Contract: SafeMath with default revert message mul","","Contract: SafeMath with default revert message mul","reverts on multiplication overflow","reverts on multiplication overflow",""
"passed","Thu Dec 23 00:28:32 GMT 2021","Thu Dec 23 00:28:37 GMT 2021","5176","","Contract: Ownable renounce ownership","","Contract: Ownable renounce ownership","prevents non-owners from renouncement","prevents non-owners from renouncement",""
"passed","Thu Dec 23 00:28:34 GMT 2021","Thu Dec 23 00:28:38 GMT 2021","4610","","Contract: AccessControl default admin","","Contract: AccessControl default admin","other roles's admin is the default admin role","other roles's admin is the default admin role",""
"passed","Thu Dec 23 01:44:59 GMT 2021","Thu Dec 23 01:45:03 GMT 2021","4215","","Contract: ECDSA recover with invalid signature","","Contract: ECDSA recover with invalid signature","with long signature","with long signature",""
"passed","Thu Dec 23 00:52:28 GMT 2021","Thu Dec 23 00:52:33 GMT 2021","5260","","Contract: ERC20 transfer from when the token owner is the zero address","","Contract: ERC20 transfer from when the token owner is the zero address","reverts","reverts",""
"passed","Thu Dec 23 01:45:10 GMT 2021","Thu Dec 23 01:45:18 GMT 2021","7437","","Contract: ERC1820Implementer with no registered interfaces","","Contract: ERC1820Implementer with no registered interfaces","returns false when interface implementation is queried","returns false when interface implementation is queried",""
"passed","Thu Dec 23 00:58:57 GMT 2021","Thu Dec 23 00:59:07 GMT 2021","10367","","Contract: ERC1155 like an ERC1155 safeBatchTransferFrom when called by the multiTokenHolder","","Contract: ERC1155 like an ERC1155 safeBatchTransferFrom when called by the multiTokenHolder","emits a TransferBatch log","emits a TransferBatch log",""
"passed","Thu Dec 23 01:24:39 GMT 2021","Thu Dec 23 01:24:51 GMT 2021","11980","","Contract: ERC721 with minted tokens transfers via safeTransferFrom without data to a user account when the address of the previous owner is incorrect","","Contract: ERC721 with minted tokens transfers via safeTransferFrom without data to a user account when the address of the previous owner is incorrect","reverts","reverts",""
"passed","Thu Dec 23 00:29:15 GMT 2021","Thu Dec 23 00:29:22 GMT 2021","7166","","Contract: AccessControl revoking with granted role","","Contract: AccessControl revoking with granted role","non-admin cannot revoke role","non-admin cannot revoke role",""
"passed","Thu Dec 23 01:46:11 GMT 2021","Thu Dec 23 01:46:14 GMT 2021","3663","","Contract: Math ceilDiv","","Contract: Math ceilDiv","rounds up on division with remainders","rounds up on division with remainders",""
"passed","Thu Dec 23 01:45:03 GMT 2021","Thu Dec 23 01:45:08 GMT 2021","4911","","Contract: ECDSA recover with valid signature","","Contract: ECDSA recover with valid signature","reverts with high-s value signature","reverts with high-s value signature",""
"passed","Thu Dec 23 01:38:52 GMT 2021","Thu Dec 23 01:39:03 GMT 2021","10692","","Contract: ERC721 with minted tokens approve when approving a non-zero address when there was a prior approval to the same address","","Contract: ERC721 with minted tokens approve when approving a non-zero address when there was a prior approval to the same address","emits an approval event","emits an approval event",""
"passed","Thu Dec 23 01:47:51 GMT 2021","Thu Dec 23 01:48:01 GMT 2021","9856","","Contract: EnumerableSet EnumerableAddressSet remove","","Contract: EnumerableSet EnumerableAddressSet remove","removes added values","removes added values",""
"passed","Thu Dec 23 01:49:35 GMT 2021","Thu Dec 23 01:50:06 GMT 2021","30620","","Contract: EnumerableSet EnumerableUintSet remove","","Contract: EnumerableSet EnumerableUintSet remove","adds and removes multiple values","adds and removes multiple values",""
"passed","Thu Dec 23 00:51:49 GMT 2021","Thu Dec 23 00:51:53 GMT 2021","3636","","Contract: ERC721 Contract interface ERC165 supportsInterface(bytes4)","","Contract: ERC721 Contract interface ERC165 supportsInterface(bytes4)","has to be implemented","has to be implemented",""
"passed","Thu Dec 23 01:05:20 GMT 2021","Thu Dec 23 01:05:27 GMT 2021","6466","","Contract: ERC1155 internal functions _burnBatch","","Contract: ERC1155 internal functions _burnBatch","reverts if length of inputs do not match","reverts if length of inputs do not match",""
"passed","Thu Dec 23 01:49:05 GMT 2021","Thu Dec 23 01:49:14 GMT 2021","9546","","Contract: TimersTimestamp","","Contract: TimersTimestamp","reset","reset",""
"broken","Thu Dec 23 00:50:33 GMT 2021","Thu Dec 23 00:50:36 GMT 2021","2844","","Contract: ERC777 with no default operators","","Contract: ERC777 with no default operators","default operators list is empty","default operators list is empty",""
"passed","Thu Dec 23 01:50:54 GMT 2021","Thu Dec 23 01:51:02 GMT 2021","7584","","Contract: Address functionDelegateCall","","Contract: Address functionDelegateCall","reverts when address is not a contract","reverts when address is not a contract",""
"passed","Thu Dec 23 01:03:50 GMT 2021","Thu Dec 23 01:04:03 GMT 2021","13694","","Contract: ERC721 with minted tokens transfers via safeTransferFrom with data to a user account when called by the operator","","Contract: ERC721 with minted tokens transfers via safeTransferFrom with data to a user account when called by the operator","clears the approval for the token ID","clears the approval for the token ID",""
"passed","Thu Dec 23 01:47:19 GMT 2021","Thu Dec 23 01:47:23 GMT 2021","4129","","Contract: Arrays findUpperBound Odd number of elements","","Contract: Arrays findUpperBound Odd number of elements","returns 0 for the first element","returns 0 for the first element",""
"passed","Thu Dec 23 00:28:20 GMT 2021","Thu Dec 23 00:28:23 GMT 2021","3220","","Contract: AccessControl Contract interface AccessControl grantRole(bytes32,address)","","Contract: AccessControl Contract interface AccessControl grantRole(bytes32,address)","has to be implemented","has to be implemented",""
"broken","Thu Dec 23 00:50:36 GMT 2021","Thu Dec 23 00:50:43 GMT 2021","7263","","Contract: ERC777 relative order of hooks","","Contract: ERC777 relative order of hooks","send","send",""
"passed","Thu Dec 23 01:44:54 GMT 2021","Thu Dec 23 01:45:03 GMT 2021","8598","","Contract: Context msgSender","","Contract: Context msgSender","returns the transaction sender when called from an EOA","returns the transaction sender when called from an EOA",""
"passed","Thu Dec 23 01:49:01 GMT 2021","Thu Dec 23 01:49:09 GMT 2021","7388","","Contract: Address functionCall with valid contract receiver","","Contract: Address functionCall with valid contract receiver","reverts when function does not exist","reverts when function does not exist",""
"passed","Thu Dec 23 01:29:25 GMT 2021","Thu Dec 23 01:29:41 GMT 2021","16018","","Contract: ERC721 with minted tokens transfers via safeTransferFrom without data to a valid receiver contract when called by the operator","","Contract: ERC721 with minted tokens transfers via safeTransferFrom without data to a valid receiver contract when called by the operator","emits a Transfer event","emits a Transfer event",""
"passed","Thu Dec 23 01:45:34 GMT 2021","Thu Dec 23 01:45:38 GMT 2021","4484","","Contract: Math max","","Contract: Math max","is correctly detected in first argument position","is correctly detected in first argument position",""
"passed","Thu Dec 23 00:51:03 GMT 2021","Thu Dec 23 00:51:11 GMT 2021","8246","","Contract: ERC20FlashMint flashLoan","","Contract: ERC20FlashMint flashLoan","unavailable funds","unavailable funds",""
"passed","Thu Dec 23 00:50:48 GMT 2021","Thu Dec 23 00:50:55 GMT 2021","7259","","Contract: ERC20Permit permit","","Contract: ERC20Permit permit","rejects expired permit","rejects expired permit",""
